[
  {
    "subject": "science",
    "topic": "cells",
    "title": "Cells — the building blocks",
    "subtitle": "What every living thing is made of",
    "readTimeMin": 4,
    "visual": "cell-comparison",
    "sections": [
      {
        "heading": "What is a cell?",
        "body": "Every living thing is made of cells. You are made of trillions. A cell is the smallest unit that can do all the jobs of being alive — taking in food, getting rid of waste, growing, and copying itself.\n\nThere are two big families: animal cells and plant cells. They share a lot but plant cells have extra parts because plants make their own food.",
        "quickfact": {
          "value": "0.02 mm",
          "label": "typical animal cell width — ~50 fit across a dot"
        }
      },
      {
        "heading": "The main parts (organelles)",
        "list": [
          "Nucleus — the control centre. Holds the DNA instructions.",
          "Cytoplasm — the jelly inside, where chemical reactions happen.",
          "Cell membrane — the skin that decides what gets in and out.",
          "Mitochondria — release energy from food (in animal AND plant cells).",
          "Cell wall — only in plant cells. Stiff outer layer for shape and support.",
          "Chloroplasts — only in plant cells. Green dots that catch sunlight to make food (photosynthesis).",
          "Vacuole — only in plant cells (large one). A bag of water that keeps the plant rigid."
        ],
        "callout": {
          "tone": "tip",
          "title": "Memory hook",
          "body": "Animal cells = NCM (Nucleus, Cytoplasm, Membrane). Plant cells add WCV (Wall, Chloroplasts, Vacuole)."
        }
      },
      {
        "heading": "Plant vs animal — the differences",
        "example": {
          "title": "What only plants have (and why)",
          "steps": [
            "Cell wall — gives the plant its rigid shape (animals have a skeleton instead).",
            "Chloroplasts — catch sunlight to make food (animals eat food, no need).",
            "Big vacuole — stores water and keeps the plant firm (animals are mostly soft tissue)."
          ]
        }
      },
      {
        "heading": "How small are they?",
        "body": "Most cells are too small to see without a microscope. A typical animal cell is about 0.02 mm wide — you'd fit fifty of them across the dot above this 'i'."
      }
    ],
    "tips": [
      "Easy memory: animal cells = NCM (Nucleus, Cytoplasm, Membrane). Plant cells add WCV (Wall, Chloroplasts, Vacuole).",
      "Plants are green because chloroplasts contain chlorophyll, which reflects green light.",
      "Mitochondria are sometimes called the cell's 'power plants' — they release energy from glucose."
    ],
    "year_level": 7
  },
  {
    "subject": "science",
    "topic": "particles-states",
    "title": "Particles & states of matter",
    "subtitle": "Why solids, liquids and gases behave differently",
    "readTimeMin": 4,
    "visual": "particle-states",
    "sections": [
      {
        "heading": "Everything is made of particles",
        "body": "Every substance — your desk, your drink, the air — is made of tiny particles you can't see. The way those particles are arranged decides whether the substance is a solid, a liquid or a gas."
      },
      {
        "heading": "The three states",
        "list": [
          "Solid — particles packed tight in a regular pattern. They vibrate but can't move past each other. Fixed shape, fixed volume.",
          "Liquid — particles still touching but can slide past each other. Takes the shape of its container, fixed volume.",
          "Gas — particles spread far apart, moving fast in all directions. Fills any container, expands to fit."
        ],
        "callout": {
          "tone": "note",
          "title": "Water is weird",
          "body": "Most substances are denser as solids than as liquids. Water is the opposite — ice is LESS dense than liquid water, which is why ice floats. This matters for life: in winter, ice floats on top of lakes and insulates the water below, keeping fish alive."
        }
      },
      {
        "heading": "Heating and cooling",
        "body": "Add heat → particles get more energy → they move more. Solid melts to liquid. Liquid evaporates (or boils) to gas. Cooling reverses each step: gas condenses to liquid, liquid freezes to solid.\n\nThe particles themselves don't change. Only their arrangement and how much they move.",
        "example": {
          "title": "What happens when ice melts",
          "intro": "Step through what's happening to the water particles:",
          "steps": [
            "Ice particles are locked in a regular pattern, vibrating in place.",
            "Heat is added → particles vibrate harder.",
            "At 0°C, particles have enough energy to break free of their fixed positions — the ice melts.",
            "Particles can now slide past each other → liquid water."
          ],
          "outro": "Add more heat and you'll reach 100°C — particles break free of each other entirely → steam (gas)."
        },
        "quickfact": {
          "value": "100°C",
          "label": "boiling point of water at sea level"
        }
      }
    ],
    "tips": [
      "Water is an unusual exception: ice (solid) is LESS dense than water (liquid). That's why ice floats.",
      "Gases are mostly empty space — that's why they squish so easily under pressure.",
      "When you smell something, gas particles from that thing have travelled through the air to your nose."
    ],
    "year_level": 7
  },
  {
    "subject": "science",
    "topic": "universe",
    "title": "The Universe — Sun, Earth, Moon",
    "subtitle": "How our corner of space works",
    "readTimeMin": 4,
    "visual": "solar-system",
    "sections": [
      {
        "heading": "The Solar System",
        "body": "Our Sun is a star. Around it orbit eight planets, lots of moons, asteroids and comets. The order of the planets, closest to the Sun first: Mercury, Venus, Earth, Mars, Jupiter, Saturn, Uranus, Neptune.",
        "quickfact": {
          "value": "150 million km",
          "label": "average distance from the Earth to the Sun (1 AU)"
        },
        "callout": {
          "tone": "tip",
          "title": "Memory hook",
          "body": "\"My Very Educated Mother Just Served Us Noodles\" — Mercury, Venus, Earth, Mars, Jupiter, Saturn, Uranus, Neptune."
        }
      },
      {
        "heading": "Why we have day and night",
        "body": "Earth spins on its own axis once every 24 hours. The side facing the Sun has day. The side facing away has night. The Sun isn't moving across the sky — WE are moving.",
        "callout": {
          "tone": "note",
          "title": "Common misconception",
          "body": "The Sun does NOT 'rise' and 'set'. The horizon rotates away from the Sun (sunset) or towards it (sunrise) as Earth spins."
        }
      },
      {
        "heading": "Why we have seasons",
        "body": "Earth's axis is tilted at about 23.5°. As Earth orbits the Sun once a year, different hemispheres point towards the Sun at different times. When it's tilted towards us → longer days, more direct sunlight → summer. Tilted away → winter.",
        "example": {
          "title": "June in the UK vs December in the UK",
          "steps": [
            "June: northern hemisphere tilts towards the Sun.",
            "Sun is high in the sky, daylight is long (~16+ hours).",
            "Sunlight hits the ground steeply → concentrated heat → summer.",
            "December: same Earth, opposite point in orbit. North tilts away.",
            "Sun is low, days are short (~8 hours), light hits at a shallow angle → spread thin → winter."
          ],
          "outro": "Note: it's NOT because Earth is closer or further from the Sun — that barely changes."
        }
      },
      {
        "heading": "Phases of the Moon",
        "body": "The Sun always lights up half the Moon. As the Moon orbits Earth (about every 27 days), we see different proportions of the lit half. New Moon (lit half facing away) → crescent → half → full Moon (lit half facing us) → and back again.",
        "quickfact": {
          "value": "27.3 days",
          "label": "time for the Moon to orbit Earth once"
        }
      }
    ],
    "tips": [
      "Mnemonic for planet order: \"My Very Educated Mother Just Served Us Noodles\".",
      "Pluto isn't on the list — it was reclassified as a 'dwarf planet' in 2006.",
      "Seasons are about TILT, not distance. Earth is actually closest to the Sun in January."
    ],
    "year_level": 7
  },
  {
    "subject": "maths",
    "topic": "shape",
    "title": "Triangles, polygons & shape names",
    "subtitle": "Naming shapes by their sides and angles",
    "readTimeMin": 4,
    "visual": "triangle-types",
    "sections": [
      {
        "heading": "Triangles by their sides",
        "list": [
          "Equilateral — all 3 sides equal, all 3 angles equal (each 60°).",
          "Isosceles — exactly 2 sides equal. The two angles opposite those equal sides are also equal.",
          "Scalene — all 3 sides different, all 3 angles different.",
          "Right-angled — one angle is exactly 90° (a right angle)."
        ],
        "callout": {
          "tone": "tip",
          "title": "Quick spot",
          "body": "Equal sides ↔ equal opposite angles. Always. So if a triangle has two equal sides, the angles opposite them must match."
        }
      },
      {
        "heading": "The angle rule",
        "body": "The three angles inside ANY triangle add up to 180°. So if you know two angles, you can always work out the third by subtracting them from 180°.",
        "example": {
          "title": "Find the missing angle",
          "intro": "A triangle has angles of 70° and 55°. Find the third:",
          "steps": [
            "Add the known angles: 70 + 55 = 125°.",
            "Subtract from 180°: 180 − 125 = 55°.",